{"schema_version":"1","tool_version":"0.2.1","cluster_model_version":"0.2.1","source":{"schema_version":"1","lean_version":"4.30.0-rc2","policy_identifier":"strict","transparency_mode":"none","declarations":5},"summary":{"declarations_scanned":5,"failing_declarations":4,"failure_findings":4,"clusters":3},"trend":{"hidden":2,"explicit_direct_prop":1,"explicit_typeclass":1,"mixed":0,"hidden_families":[{"type_name":"Example.Package","declarations":2}],"explicit_direct_prop_families":[{"type_name":null,"declarations":1}],"lanes":[]},"clusters":[{"source_class":"package","finding_kind":"unapproved_package_with_prop_fields","category":"package_with_prop_fields","type_name":"Example.Package","module":null,"lane":null,"declaration_count":2,"finding_count":2,"declarations":["Example.packageOne","Example.packageTwo"]},{"source_class":"direct_prop","finding_kind":"unapproved_direct_prop","category":"direct_prop","type_name":null,"module":null,"lane":null,"declaration_count":1,"finding_count":1,"declarations":["Example.direct"]},{"source_class":"typeclass","finding_kind":"unapproved_typeclass_assumption","category":"typeclass_assumption","type_name":"Inhabited","module":null,"lane":null,"declaration_count":1,"finding_count":1,"declarations":["Example.typeclass"]}],"limitations":["clusters rendered audit artifacts only","does not re-run Lean elaboration","does not validate proof axioms","does not sandbox Lean execution","does not prove theorem-statement equivalence","does not infer project-specific cleanup lanes","does not suggest remediation"]}
